{
  "profile": "core",
  "display_name": "Core",
  "description": "Baseline skills and capabilities safe and useful for every project regardless of product domain: orientation, deterministic repo-context packaging, spec discipline, evidence before done, change-impact review triage, PR feedback triage, secret safety, Markdown knowledge-vault maintenance, and handoff, backed by the review workflow, guardrails, evaluation gate, context packaging, secret scanning, and lightweight spec catalogue capabilities.",
  "target_projects": ["*"],
  "skills": [
    "orientation",
    "repo-context",
    "plan-spec",
    "evidence-before-done",
    "change-impact",
    "pr-feedback",
    "secret-safety",
    "markdown-vault",
    "handoff"
  ],
  "capabilities": [
    "gstack-review-workflow",
    "claude-guardrails-lite",
    "promptfoo-eval-gate",
    "repomix-context-export",
    "gitleaks-secret-scan",
    "openspec-lightweight-workflow"
  ],
  "policies": ["free-first.md", "promotion-lifecycle.md"],
  "notes": "browser-qa is intentionally excluded here: not every project has a UI. Every other profile is expected to be a superset of core's skills and capabilities, or to justify in its notes why it omits one."
}
