{
  "profile": "accentos",
  "display_name": "AccentOS",
  "description": "All ten curated skills plus review/guardrail/scanning and browser regression evidence capabilities for AccentOS. No product-specific or private context; expand as real AccentOS-specific compatible capabilities are curated.",
  "target_projects": ["AccentOS"],
  "skills": [
    "orientation",
    "repo-context",
    "plan-spec",
    "evidence-before-done",
    "change-impact",
    "pr-feedback",
    "secret-safety",
    "browser-qa",
    "markdown-vault",
    "handoff"
  ],
  "capabilities": [
    "gstack-review-workflow",
    "claude-guardrails-lite",
    "gitleaks-secret-scan",
    "playwright-regression"
  ],
  "policies": ["free-first.md", "promotion-lifecycle.md"],
  "notes": "Skills/capabilities intentionally match product-build at foundation stage; grow this list as AccentOS-specific compatible capabilities are curated, without any artificial cap."
}
